Title,Location,Company,Description
Software Engineer,"Johns Creek, GA","Macy's
3.2","Job Overview:

At Macys, were moving fastwere at top speed to become Americas premiere retailer. Macys Technology strives to set the pace by providing seamless and compelling shopping experiences for our Macys and Bloomingdales customers. Macys Technology is creating innovative technology solutions to support these experiences and define the future of retailing.

This job function is responsible for translating business requirements into well-engineered, tested and deployed application systems that are used by the business as well as supporting these systems while in production.

Positions in this function interface with internal customers to determine the most efficient and cost-effective approach to meet their business requirements and are responsible for designing, developing, testing, installing, and deploying the required software applications. Solutions utilize a variety of software technologies and may include new code construction, modifications to existing modules, configuration and/or package implementation. Perform other duties as assigned.
Essential Functions:
Write core java code adhering to overall architecture and design of existing applications.
Work closely with Quality Assurance to resolve any issues reported by QA / Test Analysis.
Understand performance metric and factors affecting the performance and find ways to improve it.
Leverage automation for increased efficiency.
Track own progress to ensure timely delivery.
Work collaboratively with Product teams to brainstorm on business features.
Bring in fresh ideas to make improvements.
Participate in code reviews for own as well as others' code.
Work with other teams involved in project life-cycle.
Regular, dependable attendance and punctuality.
Qualifications:

Education/Experience:
Bachelor's Degree (Preferably CS, CE or IT).
0-3years of experience as a Software Developer.
Deep understanding of Core Java and Multithreading, Streaming and Event Driven.
Experience with Ultra Low Latency programming and performance tuning.
Experience in developing distributed application, API development using REST architectural guidelines.
Familiarity with Linux, Maven, Git, Jira.
Agile and test-driven development experience.
Retail industry experience will be a plus.
Communication Skills:
Excellent written and verbal communication skills.
Able to read, write, and interpret complex documents.
Mathematical Skills:

Basic math functions such as addition, subtraction, multiplication, division, and analytical skills.
Reasoning Ability:
Must be able to work independently with minimal supervision and make sound decisions.
Physical Demands:

This position involves regular walking, standing, sitting for extended periods of time, hearing, and talking.
May occasionally involve stooping, kneeling, or crouching.
May involve close vision, color vision, depth perception, focus adjustment, and viewing computer monitor for extended periods of time.
Involves manual dexterity for using keyboard, mouse, and other office equipment.
May involve moving or lifting items under 10 pounds.
Other Skills:
Lead the development phase of projects, making work assignments and managing task completion.
Select tools/methodologies for projects.
Commit to deliverables for scope of work.
Modify jobs and schedules for jobs as necessary.
Work Hours:

Ability to work a flexible schedule based on department and company needs.
Company Profile:

Macys Inc. is one of the nations premier retailers. With fiscal 2016 sales of $25.778 billion and approximately 140,000 employees, the company operates more than 700 department stores under the nameplates Macys and Bloomingdales, and approximately 125 specialty stores that include Bloomingdales The Outlet, Bluemercury and Macys Backstage. Macys, Inc. operates stores in 45 states, the District of Columbia, Guam and Puerto Rico, as well as macys.com, bloomingdales.com and bluemercury.com. Bloomingdales stores in Dubai and Kuwait are operated by Al Tayer Group LLC under license agreements. Macys, Inc. has corporate offices in Cincinnati, Ohio and New York, New York.

This job description is not all inclusive. Macys Inc. reserves the right to amend this job description at any time. Macy's Inc. is an Equal Opportunity Employer, committed to a diverse and inclusive work environment."
Software Developer,"Indianapolis, IN","Spot Inc
3.1","About Spot

Since 2009, Spot has built a team of motivated and knowledgeable employees dedicated to making sure every shipment, every customer, and every contract carrier is taken care of. Thats why, no matter what time or day, were always available. Consistently ranked on the Inc. 5000s Fastest Growing Companies and IBJs Fast 25, we have grown into one of the fastest growing companies in the nation with over 200 employees across our 2 locations. We have plans to hire an additional 350 people by 2023. Join a team that rewards your hard work and is committed to your success.

What Youll Be Doing:

As a Software Developer, you are key in the design, installation, testing, and maintenance of our proprietary software, RED. Your goals are to make the company more efficient and provide better customer service through technology. This role is most concerned with the overall functionality and development of the technology, ensuring that there are no stumbling blocks. This person strives for perfection and understands continuous improvement processes. The Software Developer is responsible for work in all stages of the development life cycle - reviewing business requirements, design, construction, testing, and implementation.
Has the ability to prioritize multiple projects, while meeting deadlines and quality expectations.
Is able to adapt quickly in a changing environment.
Develops strategy to meet user requirements, in collaboration with the IT team.
Applies advanced system design knowledge.
Using Information Technology: Serves as an IT expert in the organization.
Technical lead experience including the ability to coordinate the development efforts of a small team.
Our Ideal Candidate Is/Has:
Ability to pass a competency assessment for coding.
2+ years of proven experience developing web and client server solutions.
Expertise in the following languages is required: C#, JavaScript, and SQL.
Familiarity with Web Front Ends is preferred, but not required (JavaScript, React, CSS, etc.).
Experience with client side libraries application frameworks (Bootstrap, AngularJS, BackboneJS, jQuery, jQuery UI etc.).
Experience with development tools (Bower, Grunt, etc.).
Experience using Agile/Scrum methodologies.
Experience with the following platforms is highly preferred: ASP.NET MVC, WebAPI, VB RESTful API, and WCF (or other SOA implementations).
Working knowledge of reporting tools (Telerik reporting/SSRS, etc.).
Working knowledge of Github is a bonus.
Why Spot?
Be able to make an immediate impact in a rapidly growing company
Comprehensive training program to set you up for success
Ongoing career development and internal advancement opportunities
Modern, downtown office with a bowling alley and an on-site gym
Casual dress code- Spot gear for the days you cant decide what to wear
Convenient downtown parking
Comprehensive medical, dental, and vision insurance
Life insurance and 401k with employer match
Spot Freight provides equal employment opportunities to all employees and applicants for employment and prohibits discrimination and harassment of any type without regard to race, color, religion, age, sex, national origin, disability status, genetics, protected veteran status, sexual orientation, gender identity or expression, or any other characteristic protected by federal, state or local laws. Spot Freight is committed to working with and providing reasonable accommodation to individuals with disabilities. If, because of a disability, you need a reasonable accommodation, please send an email to humanresources@spotinc.com to notify us of your request. This policy applies to all terms and conditions of employment, including recruiting, hiring, placement, promotion, termination, layoff, recall, transfer, leaves of absence, compensation and training."
Software Engineer,"Redwood City, CA","Q Bio
4.1","We believe the future of healthcare will be orders of magnitude more effective, data driven, preventative, and personalized. The current system is bogged down by misaligned incentive structures and a lack of data derived insights. Therefore, we intend to reinvent it.

At Q Bio, your ideas and development efforts will directly impact the new foundational tools and systems we are building to empower patients and their physicians to quantify, track, and analyze physiological changes in unprecedented detail.

Our product, The Q Exam, is based on landmark systems biology research done at Stanford University.

Q Bio was founded by Jeffrey Kaditz, Founder of Affirm, Dr Michael Snyder, Chair of Genetics and Director of Personalized Medicine at Stanford University, and Dr Garry Choy, physician, radiologist, and former Chief Medical Information Officer at Mass General Hospital. We are backed by venture groups including: A16Z, Khosla Ventures, Founders Fund, SciFi VC, and Kevin Durant.

As a Software Engineer at Q Bio, we'll help you showcase your talent and personal style while you:

Learn more about human health and biology.
Thrive in a collaborative environment involving different stakeholders and subject matter experts.
Work on well defined products and projects to completion.
What you will do in this role:
Architect, design and build software for a data-intensive medical data platform and dashboard.
Help choose and integrate tools and frameworks to make engineers more productive and efficient.
Refactor and improve existing code, while increasing quality and adding new functionality.
Partner with other team members: engineers, users and business stakeholders.
Participate in design and code reviews, provide feedback to improve the quality of software code.
Optimize the performance of web applications and services.
Skills and experience you will bring to this role:
B.S. Computer Science or equivalent experience.
4+ years of full-stack software engineering experience using modern tools and frameworks in data-driven applications and services.
Expertise in one or more modern programming languages.
Strong verbal and written communication skills.
Fast learner, ability to quickly pick up new technologies and rapidly assess pros/cons.
Demonstrated ability to make practical design/implementation tradeoff decisions.
Benefits we value for our team:
Competitive salary and equity in a well-funded, early stage startup
Healthcare, vision, and dental coverage for you and your dependents
Personalized catered meals every day
The opportunity to become an expert in computational biology, biotechnology and the cutting edge of digital healthcare technology while getting hands on experience with it

We are an equal opportunity employer and value diversity at our company. We do not discriminate on the basis of race, religion, color, national origin, gender, sexual orientation, age, marital status, veteran status, or disability status."
Software Engineer,"Columbia, MD","Fortego
5.0","If you enjoy designing, developing and analyzing hard logic problems, consider growing with our team of engineers who never shy away from understanding Windows or Linux OS internals such as processes, threads, synchronization, drivers, virtual memory, kernel objects, etc. At Fortego, you will embark on a journey of exciting, impactful & highly technical work with good people that treat you like family.

If you’re a developer with any of the following experience who can think outside-of-the-box, who aren’t afraid of breaking things, and who enjoy doing things in ways they aren’t supposed to be done, with a TS/SCI with a Polygraph, we encourage you to apply.
As an ideal candidate, you will have any of the following experience:
C, C++, x86 Assembly programming
Windows, Linux, Mobile, Embedded Systems
Strong knowledge of OS internals
Network experience (sockets, TCP, UDP, Wireshark)
Experience with build systems
Desired, but not required:
Python, Ruby experience
Reverse Engineering experience (IDA Pro, WinDbg, etc)
Kernel Development experience
Vulnerability analysis and exploit development experience
Required qualifications:
TS/SCI with a Polygraph
Minimum of 4 years of experience or a bachelor's degree
Looking for junior, mid, and senior level engineers
The benefits:
Rewarding your hard work: Referrals, sign on, profit sharing, quarterly awards… need we go on?
Generous training budget: Designed by you.
PTO that has your back: For the families and the unbounded adventures, from furloughs to inclement weather, we are there.
Top-notch health care and 401k package: If these drive you, this is your stop.
Something always going on: Team lunches, happy hours, fantasy leagues, game nights, homebrew competitions and monthly family events.
We support innovation: Got an idea? Want to learn something new? Whatever it is we will help see it through.
About Fortego:
Fortego helps solve some of the most difficult cyber issues the world faces today. Our employees spend their working hours deep in the trenches handling the most critical and exciting challenges on the national security front. As for the other hours of the day, you will find Fortego employees kicking back and enjoying benefits that span from family activities to sporting events, supporting veterans in the community, and exploring new tech.
Fortego is an Equal Opportunity Employer and all qualified applicants will receive consideration for employment without regard to race, color, religion, sex, national origin, disability status, protected veteran status, or any other characteristic protected by law.
About Fortego
Fortego helps solve some of the most difficult cyber issues the world faces today. Our employees spend their working hours deep in the trenches handling the most critical and exciting challenges on the national security front. As for the other hours of the day, you will find Fortego employees kicking back and enjoying benefits that span from family activities to sporting events, supporting veterans in the community, and exploring new tech.

Fortego is an Equal Opportunity Employer and all qualified applicants will receive consideration for employment without regard to race, color, religion, sex, national origin, disability status, protected veteran status, or any other characteristic protected by law."
Software Developer,"Phoenix, AZ","KUBRA
3.5","Overview</h2>

New position alert! KUBRA Arizona is looking for a skilled Software Developer for our Implementation team. As a Software Developer, you will work on a team to implement enterprise customer experience management software for our clients.

What you get to do every day
Write code and contribute to the software architecture of a highly concurrent, highthroughput system
Contribute to finding solutions for converting client requirements into product implementations
Contribute to design of new functionality and expand existing functionality
Participate in implementation teams and collaborate with Project Managers, Software Engineers, and designers
Manage projects and tasks using a variety of technologies
May travel to visit clients throughout North America to participate in design sessions and deliver technical presentations and training
What kind of person should you be?
You enjoy working with working in a team, extending existing code bases, and using version control systems
Impeccable problem-solving and analytical skills
Your ability to communicate effectively with customers is outstanding
Great time management skills
What skills do you need?
Bachelor’s degree in Computer Science or Engineering, or equivalent experience, however a Master’s degree is preferred
Minimum of 4 years of experience in Java environments
Minimum of 4 years of Full Stack Development
Experience with Amazon AWS cloud facilities such as EC2, S3, and RDS is preferred
Experience in Java concurrency and Relational databases
Proficiency in JavaScript, Java and object-oriented design, with knowledge of Spring and Java EE
Experience with RESTful services
Experience using build tools like npm, bower and grunt
Experience in one of the modern JavaScript frameworks (AngularJS or ReactJS is preferred)
Comfort with working in a team, extending existing code bases, and using version control systems
What can you expect from us?
A unique, supportive, and flexible work environment
Challenges related to working in a fast-paced, growing environment
Confidence to take risks when we see potential
A management team that cares about people
Exposure to and experience on an industry leading cloud based project management information system
An extensive orientation program including job shadowing from your first 30 days up to six months
Mentorship from within both the PMO and Technical/Business Team Structure at KUBRA
An opportunity to learn and gain exposure to advanced payment technologies in a rapidly growing and competitive industry
A chance to join the occasional beach volleyball game or board game night
We are a fast-growing and dynamic company offering customer experience management solutions to some of the largest utility, insurance and government entities across North America. Our portfolio of meter-to-cash and outage communication solutions includes billing and payment, mapping, mobile apps and proactive customer communications solutions for customers. With more than 1 billion customer experiences annually, we have the ability to provide performance-driven value to more than 550 clients every day.

Our office is small enough to allow creative individuals to flourish, yet large enough to provide long-term stability. We place a tremendous amount of responsibility on our team members to be productive, focused and self-motivated. We offer a casual work environment, competitive compensation and a stellar benefits program.

KUBRA is an equal opportunity employer dedicated to building an inclusive and diverse workforce. We will provide accommodations during the recruitment process upon request. Information received relating to accommodation will be addressed confidentially. We thank all applicants for their interest; however, only candidates under consideration will be contacted.

</br>"
Full-Stack .NET Software Engineer,"Layton, UT","AdvisorPeak, Inc.","AdvisorPeak, Inc. was founded by former investment advisors and wealth management industry veterans with the vision of bringing innovative software to the financial services industry. We create trading software to help advisors across the country manage and trade their client accounts. We keep our work environment fun, relaxed, and flexible with your real life. Every team member plays an integral part in building and maintaining that culture.

ROLE DESCRIPTION

Our development team collaborates to create software to meet the trading needs of investment advisors. Your position will be part of a team that is creating the next generation of our software, as well as supporting and maintaining the existing version of the software.

KEY RESPONSIBILITIES

·
Write, test, deploy, and support new and existing systems

·
Accelerate the development of AdvisorPeak’s platform

·
Expand AdvisorPeak’s APIs

·
Work with minimal supervision as part of a small team

·
Manage your time well

EDUCATION AND EXPERIENCE

·
Degree in computer science, software engineering, or related studies preferred.

·
4+ years of experience developing enterprise level applications utilizing C#, SQL, HTML, Javascript, CSS, etc.

·
Experience with modern JavaScript frameworks such as AngularJS, Vue, React, etc.

·
Experience with MSSQL.

·
Experience developing & deploying in an agile environment.

·
Comfortable working with Git and Github.

KNOWLEDGE, SKILLS AND ABILITIES

·
Willingness to learn new development technologies, strategies and tools with an open mindset. If you have religious feelings about programming languages or tools, we're not the company for you.

·
Works well with a small, close-knit team.

·
Not afraid to tackle problems that are difficult.

·
Self-manager– we're not big on bureaucracy; we don't micromanage but hold each other accountable as a team.

·
Technical leadership – ability to lead other developers, drive the product and team forward.

·
Ability to own what you are building and see it through from end to end.

·
Designing web service API's.

JOB REQUIREMENTS

·
As we work with sensitive financial information, you must pass a criminal background check.

·
Must be local to Utah and willing to work in our Layton office.

COMPENSATION & BENEFITS

·
Competitive market salary based on experience

·
Benefits package that include 100% health, dental, vision, life insurance and LTD for employee

·
401k Plan

·
Paid Holidays and unlimited time off program

·
Flexible dress code

·
Dog friendly office

·
Stock options available

·
Startup environment"
Software Engineer,"Princeton, NJ","ALK Technologies
3.9","Were looking for passionate software engineers at all levels of experience, from college graduates to senior-level professional. Trimble MAPS is an established leader, providing software solutions for the transportation and logistics needs of our customers. Our engineers directly shape our future and have the opportunity to influence products from day one.

This role is important because we are building the next generation of products across all major mobile and desktop platforms while also maintaining our existing revenue-generating products already in the field. We need more talented and versatile developers to help solve a range of interesting problems.

Job Description:
Software Engineers at Trimble MAPS are responsible for designing, implementing, testing, and maintaining our products. This specific position requires work in a few potential areas, including initiatives related to improving the quality of our map data, supporting existing products in the field, and implementing new product features. Most importantly, this position requires a strong coder and persistent problem solver, who desires to: 1) take pride in overall product and code quality, 2) solve challenging problems individually, 3) learn new skills as the need arises, and 4) help automate testing for new and existing features.

Qualifications:
BS in Computer Science, or similar degree
Excellent coding, debugging, and problem solving skills
Professional or academic experience coding in C++, C#, or Python
Experience using object oriented concepts in any programming language
Experience using complex data structures and algorithms to solve problems
Understanding of relational databases and SQL
Understanding of multi-threaded application design and implementation
Desire to automate unit and integration testing
Basic understanding of web services and HTTP is a plus
Strong verbal and written communication skills
Trimble MAPS is located on Route 1 in Princeton, NJ in a new office beautifully designed to support our recent and expected future growth. Princeton is conveniently located between New York City and Philadelphia.

Trimble MAPS offers great benefits such as a generous PTO package, paid healthcare, 401K, stock options, ESPP, education reimbursement, and many wellness initiatives. We also offer flexible schedules, casual dress, volunteer opportunities, child care discounts, and a corporate womens network.

Trimble is proud to be an Equal Opportunity and Affirmative Action Employer and considers qualified applicants for employment without regard to race, gender, age, color, religion, national origin, marital status, disability, sexual orientation, status as a covered veteran in accordance with applicable federal, state and local laws, or any other protected factor. EOE/M/F/V/D

#engineering"
