Title,Location,Company,Description
Software Developer,"Melville, NY","EVO Payments
2.9","We are excited to welcome a dynamic Software Developer to our growing Melville, NY office. Join the team behind one of the world's largest financial technology providers. EVO Payments Inc. is a leading publicly traded payments processor servicing 600,000 merchants, and licenses across 50 countries in Europe and North America.

Why work at EVO?
Learn from and grow with a worldwide payments industry leader
Benefit from global career opportunities and advancement
Thrive in a collaborative culture that supports innovation
Take advantage of a supportive work-life balance
Enjoy a competitive salary and a comprehensive benefits package: 401k with match, generous paid time off, medical, dental, vision coverage plus health savings accounts and much more
The goal of the role: As a Software Developer, you will be responsible for designing and writing code to support existing applications and or designing and developing web-based applications to support project needs. We want someone to join a smart and complex team to help us continue to move forward.

What will you be doing?
Designing and developing web-based applications utilizing Microsoft .NET technologies, with a proficiency in C# development
Performing maintenance and modifications of programs currently in production
Modifying or expanding coding to accomplish specified processing changes
Creating and supporting windows client-server/web applications developed in house
Unit-testing on modified programs to ensure user data accuracy and modifications have no adverse impact on systems operation
Assisting project managers or other department team and management members in defining and creating all project documentation
Referring any problems or situations that users may be experiencing to the Team Lead and/or Development Manager
Communicating project status and deliverables with managers and clients
Providing assistance to project lead in analysis, design, development, and support for in-house developed applications
Performing related projects and duties as needed
You could be a great fit with these qualifications:
BA/BS degree in computer science, information technology or a related discipline
Must have at least 3 years of C# .Net Web application development and Microsoft SQL database development experience
Hands on experience in web development skills using C#, ASP .NET, J-Query, XML, XSL, JavaScript, HTML, DHTML, CSS, and Web Services
Experience in Bootstrap & MVC a plus
Strong working knowledge in Microsoft .NET technology
Must be proficient in system development life cycle (SDLC)
Experience in Financial industry a plus
Excellent listening, presentation and interpersonal skills
Ability to communicate ideas in both technical and user-friendly language
Ability to work independently, resolve conflicts, and prioritize workflow in order to meet deadlines
Ability to maintain confidentiality
Ability to establish priorities, work collaboratively, and meet objectives
Must have a positive attitude and strong customer service skills
Creative, self-motivated with good analytical and problem solving skills
Ability to work in a fast-paced work environment
Upon accepted offer, you will be required to submit to a pre-employment drug test and background check
We are an equal opportunity employer and value diversity at our company. We do not discriminate on the basis of race, religion, color, national origin, gender, sexual orientation, age, marital status, veteran status, or disability status."
Software Engineer,"San Diego, CA","Chesapeake Technology International
4.1","Help build and architect a first-of-its-kind Electronic Warfare management, planning, visualization, and collaboration system.

CTI's platform extends beyond Electronic Warfare-related hardware and software. Data management, from collection to transfer to storage and analysis, is a critical element in transforming information into actionable and intuitive visual intelligence. This is a position that will work as part of a team to architect, implement, and deploy innovative technologies to support both military and commercial users. We strive to use the right technology for a given problem and foster a learning environment.

Sample projects
• Architect and build a cutting edge platform of APIs and services for desktop, mobile, and web applications to control airborne UAV payloads.
• Architect a system to allow 3rd parties providing services such as computer-aided vision, machine learning, and data analysis controlled access to customer data
• Build the service that ingests streams of data from various sensors in real-time
• Build out a data warehouse to analyze large amounts of telemetry and sensor data
• Create immersive 3D visualizations for cyber security and radio frequency domains

Roles and Responsibilities
• Design, develop, document, test and debug new and existing software systems and/or applications.
• Participate in full development life cycle including requirements analysis and design.
• Write technical specifications based on conceptual design and stated business requirements.
• Support, maintain and document software functionality.
• Identify and evaluate new technologies for implementation.
• Analyze code to find causes of errors and revise programs, as needed.
• Participate in software design meetings and analyze user needs to determine technical requirements.

Job Requirements

Necessary skills and experience
• U.S. Citizenship - all positions require a U.S. Security Clearance
• Bachelor's Degree in Math, Computer Science, Electrical Engineering or other Engineering
• 3 or more years in programming, engineering or related experience
• Java, C++ or similar object-oriented programming languages
• Other JVM Languages such as Scala and Clojure
• Sound understanding of Build Tooling, such as Ant, Gradle or Maven
• Sound understanding of Version Control Systems, such as Git, Mercurial or Subversion
• RESTful API design
• Relational and key value data stores such as PostgreSQL, Cassandra, and MongoDB
• Experience architecting software and distributed infrastructure
• Experience driving technical decisions
• Experience with testing methodology
• Ability to work both independently and with a team

Beneficial skills and experience
• Actor Model Frameworks
• Familiarity with Geospatial Data
• NodeJS
• Amazon Web Services or NASA Worldwind
• Front end development using Javascript, Clojurescript, and ReactJS.
• Real-time data streaming

About CTI

CTI is building the next-generation cyber and electronic warfare platform comprising hardware, firmware, software, and user interfaces. We are a rapidly growing company offering the following:
• Medical, dental and vision insurance
• H.S.A. (partially funded by CTI) and Flex Spending
• Company-paid life insurance/AD&D and disability insurance
• Optional supplemental life, critical illness and accident insurances
• Paid vacation, sick leave and holidays
• 401k plan with Safe Harbor contribution
• Tuition reimbursement/professional training options
• Employee Assistance Program
• Travel Assistance
• Financial Planning Assistance
• Flexible schedules with telecommuting options
• Service awards program
• Bonus plan

We are a passionate team who believe in ownership, excellence, building community, and continuous improvement. Here you will find the computer hacker, RC hobbyist, homebrewer, and mobile app designer. If you thrive on solving challenging problems with a fun group of really bright people, we want to hear from you!

Exemption Type

Exempt

Hiring Manager

Pompelia, Cory (Systems Engineer - DIVISION NUMBER 1 (1.01.01.00))

CTI is an Equal Opportunity employer and shall abide by the requirements of 41 CFR 60-1.4(a), 60-300.5(a) and 60-741.5(a). These regulations prohibit discrimination against qualified individuals based on their status as protected veterans or individuals with disabilities, and prohibit discrimination against all individuals based on their race, color, religion, sex, sexual orientation, gender identity or national origin. Moreover, these regulations require that covered prime contractors and subcontractors take affirmative action to employ and advance in employment individuals without regard to race, color, religion, sex, sexual orientation, gender identity, national origin, disability or veteran status."
Software Engineer/.NET Developer,"Omaha, NE",TEMPLE 4TH TECHNOLOGIES,"We are looking to hire an experienced Net Developer to help us keep growing. This is a 6 month contract to hire position with competitve pay for the right candidate. The selected candidate will receive signing bonus for this position upon completion of their first month! If you're hard-working and dedicated, apply today!

Responsibilities
Write clean, scalable code using .NET programming languages
Remain up to date with the terminology, concepts and best practices for coding mobile apps
Develop technical interfaces, specifications, and architecture
Use and adapt existing web applications for apps
Create and test software prototypes
Develop client displays and user interfaces
Assist software personnel in handling project related work and other requirements
Coordinate with other software professionals and developers
Qualifications
Familiarity with the ASP.NET framework, SQL Server and design/architectural patterns (e.g. Model-View-Controller (MVC)
5 years of development experience using C# .NET
3 years of experience with React and JQuery
Familiarity with architecture styles/APIs (REST, RPC)
Understanding of Agile methodologies
Strong attention to detail
Excellent troubleshooting and communication skills
Knowledge of REST and RPC APIs
Able to work well in a team setting

The selected candidate will receive signing bonus for this position upon completion of their first month!"
Senior Software Engineer,"New York, NY","Managed By Q
4.3","About Managed by Q:

Managed by Q is the first tool designed for workplace teams. By managing their work in a single place, teams are able to keep track of their projects, be more productive, and create a better experience for their office. Managed by Q helps workplace teams minimize the chaos of running an office and maximize the impact they have on their company. Empowering the workplace team means a better day at work for everyone.

Engineering at Q:

We are using technology to take the headache out of office management. We are building a platform to help office managers run their offices seamlessly, to allow vendors to fulfill requests with ease, and to enable our employees to work more efficiently. We have a problem-solving culture that is based on making an impact instead of hitting arbitrary deadlines.

Software Engineer:

You will be responsible for making engineering design decisions and developing features that support our technical and product strategy. We are solving logistics problems such as consolidating billing, dispatching the right person to the right place at the right time, helping employees book services seamlessly, vendor fulfillment, and a robust Marketplace. We follow best practices, to ensure we're writing clean, tested, and scalable code.

What we are looking for:
We take a generalist approach to hiring. We're looking for smart engineers who are problem solvers and passionate about their craft
4+ years experience building software or web applications
Doesn't matter what language, just a focus on writing well designed code (our stack is JavaScript, Python, MySQL, and PostgreSQL)
Experience building and deploying complex but well architected, maintainable, and testable applications
Strong communication skills- having the ability to understand and explain technical issues to non-technical team members
Benefits/Perks:

In addition to offering world-class health benefits, 401(k) matching, parental leave, and highly competitive compensation, Managed by Q also offers a work culture of psychological safety, transparency, and continuous learning. We have an Employee Resource Group, which leads the charge on wellness and inclusion initiatives, and host an annual all-company Hack Day (not just for tech folks). Every other week, all employees get together over catered lunch to build bridges between teams, and monthly, one of MbQ's people leaders hosts a workshop for managers focused on effective leadership."
Software Engineer,"Fredericksburg, VA","SimVentions
4.5","SimVentions, consistently voted one Virginia's Best Places to Work, is looking for a Software Engineer to join our Electronic Warfare team dedicated to supporting our government customer in delivering integrated products to the Navy's combat systems.

Responsibilities:
The software engineer must be familiar with the SW development cycle and will be responsible for tracking software development, software tasking, and identifying I&T milestones.
Travel to other locations to support design reviews and test events
Required Skills and Experience: Minimum of 5 years of experience using software processes, principles, techniques, and procedures in the development of Navy systems

Preferred Skills and Experience: Basic knowledge of Electronic Warfare concepts

Education: Bachelor of Science in engineering, mathematics, physics, or computer science

Clearance: Ability to obtain Secret clearance

Why Work for SimVentions?


SimVentions is about more than just being a fun place to work. We are a family of like-minded individuals who care for, support and encourage each other. We are here to imagine, create, explore, discover, and do great things together.

Support Our Warfighters

SimVentions is a proud supporter of the U.S. military, and we take pride in our ability to provide relevant, game-changing solutions to our armed men and women around the world.

Drive Customer Success

We deliver solutions that go beyond the expected. This means you can expect to work with a team that will do whatever it takes to ensure our customers are successful and happy with our results.

Get Involved in Giving Back

We believe that one of the best ways to be a well-rounded company is to have well-rounded employees, and one of the ways we encourage that is by providing a wide range of service opportunities for our team members throughout the year.

Build Innovative Technology

SimVentions takes pride in it's innovative and cutting edge technology, so you can be sure that whatever project you work on, you will be having a direct impact on our customer’s success.

Work with Brilliant People

At SimVentions, we don’t just hire the smartest people. We hire experienced, creative individuals who are passionate about what they do, and who embody the culture that we have created here.

Create Meaningful Solutions

We always have a wide variety of challenging, meaningful problems to solve at SimVentions, which span the whole range of our six core disciplines.

Employees who join SimVentions will enjoy benefits like:
The impact benefit– work on projects that directly impact the safety of our country
The purpose benefit– be part of something bigger where our profits help the needy
The co-worker benefit– work with the best and brightest people in the business
The dress code benefit– business casual. We like to be comfortable while we work
The healthcare benefits– one of the best packages in the industry
The bacon benefit– if the CEO eats the last piece of bacon you get to blast him with Nerf darts
The breakfast benefit– the“C’s” fix you breakfast once a year
The food benefits– we have a lot of food around here
Other Perks:
On-site Chaplain and prayer room
Lots of employee-appreciation events throughout the year
Excellent working facilities and tools to get your job done
Regular communication (“All-Hands”,“SimV Share”,“Imagineering Day”) to stay connected to SimV culture, stay abreast of what is happening in the company, and meet new faces while eating good food
SimVentions sports teams and workout groups
Employee led interest groups for personal and professional development
What you bring to the table…"
"Software Engineer, Senior - C++ (CoreDev)","New York, NY","HC Technologies
3.7","Software Engineer, Senior C++ (core dev) at HC Technologies (New York)
About Us:
HC Technologies is a premier algorithmic and discretionary trading firm with a specialty in the Foreign Exchange and Futures markets. With offices in Chicago, New York and London, we unite talented individuals with innovative technology and robust risk management to identify trading opportunities within the global marketplace. HC Technologies is ranked number one in Euromoney's 2018 FX survey for market share in the Americas region and is a direct trading member of the CME Group exchanges, ICE Europe, ICE US, and Eurex.
Job Description:
We are seeking a talented Senior Level C++ Developer to join our core engineering team. In this role, you will help design, develop, and implement our real-time financial trading applications. You will work cross-functionally with various stakeholders, trading teams, and technology departments to ensure our applications are running at optimal performance.
Your general milestones for the first year are the following:
Within two months, learn fundamentals of the high-performance trading system API and development frameworks
Within 3 months be able to use the company’s development process including revision controls, pull requests, feature planning, and built environments
Within 6 months, develop an understanding of FX and Futures trading and risk controls
Within 9 months, be able to implement and simulate a basic trading model with supervision
Within one year, be able to make feature enhancements to core components with some supervision and to diagnose problems and propose solutions to trading systems components. May also be required to work with traders and quants to implement or enhance trading systems or predictive models
Responsibilities:
Build, design, and operate mission-critical systems that are dependent on financial market transitions
Design and develop core components in C++
Responsible for working with various teams on core trading software infrastructure
Collaborate with quantitative traders to design and test trading models
Create and implement system testing procedures
Qualifications:
Solid understanding of Linux System, can do efficient, reliable programming
Strong proficiency with GNU, or Intel C/C++ compilers, SQL and Git
Proficiency in socket programming
Solid understanding of CPU architecture and cache analysis.
Strong Familiarity with testing frameworks
Strong familiarity with common tools (make, git, bjam, valgrind, unittest, gdb, etc)
Knowledge of trading futures and FX system preferred, but not required
Desired Experience:
Previous experience designing and implementing new systems and features independently
Brings production support experience and can troubleshooting issues under pressure
Previous experience with application profiling and debugging
Familiarity with common frameworks (Boost) and Java, Python, and Perl
BA/BS in Computer Science, Information Science, Engineering, Math, or 5 years of equivalent experience
Benefits:
Competitive base salary and bonus
Excellent benefits that include robust medical, dental, life insurance, 401k, and vision plans
A casual and open work environment without cubicles
Plenty of snacks, coffee/espresso, and catered lunches every Friday
Quarterly team building exercises
Ability to partake in offsite charities and community service events"
Software Engineer,"Newton, MA","TechTarget
3.6","Software Engineer

Department: Product Development & Technology

Location: Newton, MA

TechTarget’s Product Development group is seeking a Software Engineer to provide technical expertise to support the company’s growth. The candidate will work in a Lean/Agile environment where the business and product development groups work side-by-side to create innovative and scalable solutions. This is a great opportunity to showcase technical skills while helping to solve real world problems. The candidate will be required to build solutions that cover the full application technology stack, i.e. UI to the database and are motivated to succeed and explore new ideas based upon your own creativity and enthusiasm.

Essential Job Functions:
Work closely with Software Developers / QA Engineers and the business to build outstanding products;
Develop scalable, robust, secure, enterprise web applications;
Write functional, clean, scalable code;
Write design/technology specs as required;
Understand and work within existing business and development procedures;
Enhance tools and processes to improve product design/development; and,
Develop a deep understanding of product functionality and how it relates to business goals and practices
Knowledge, skills and abilities required:


Bachelor’s degree in Computer Science or equivalent;
1-5 years’ software development experience;
Good knowledge of Java;
Good knowledge of JavaScript, SQL;
Good verbal and written communication skills;
Proven troubleshooting and problem solving skills; and,
Strong attention to detail
Nice to have:
Experience with Spring / Hibernate
TechTarget, Inc. is an equal opportunity employer and complies with all applicable federal, state, and local fair employment practices laws. TechTarget strictly prohibits and does not tolerate discrimination against employees, applicants, or any other covered persons because of race, color, sex (including pregnancy), age, national origin or ancestry, ethnicity, religion, creed, sexual orientation, gender identity, status as a veteran, and basis of disability or any other federal, state or local protected class. This policy applies to all terms and conditions of employment, including, but not limited to, hiring, training, promotion, discipline, compensation, benefits, and termination of employment. TechTarget complies with the Americans with Disabilities Act (ADA), as amended by the ADA Amendments Act, and all applicable state or local law.

Apply
Company
About Us
Careers
Press Room
Contact Us
Investor Relations
Customer Success
Why TechTarget
Overview
Audiences
Purchase Intent
Intent-driven Services
Solutions
Overview
Tech Marketing
ABM
Tech Sales
Intent-driven Services
Products
Overview
Data-Driven Display
Priority Engine
Qualified Sales Opportunities
Lead Generation
Custom Research
Global
Français
Deutsch"
